Year,Title,Abstract,Authors,Affiliations,URL
2015,Exemplar models can’t see the forest for the trees,"We investigated human learning and generalization of three novel category structures based on eight exemplars in a continuous (9x9) stimulus space. Each category requires attention to both dimensions, but they differ in their organization. Critically, all three category types are matched on within- and between-category exemplar distances. The first category structure conforms to a condensation or information-integration type of problem with two classes separable by a diagonal bound. The other category structures cannot be solved with a linear decision boundary. We found that learners trained on the diagonal bound structure showed significantly better learning and generalization performance. In computational simulations, we found that an exemplar model (ALCOVE) could not account for the observed pattern. We posit that ALCOVE is constrained by the matched distances to learn these category structures at the same speed. Another similarity-based model with different basic design principles (DIVA) provided a good account of the behavioral data.",>Nolan Conaway>Kenneth Kurtz,>Binghamton University>Binghamton University,https://mindmodeling.org/cogsci2015/papers/0522/index.html
2015,That's not the whole story: The role of reliability and credibility in evidential reasoning,"How do people reason about complex bodies of legal evidence? The story model of juror decision-making posits that people construct stories to determine guilt. But the story model does not model how evidence items relate to elements within the story, how the credibility and reliability of the evidence (e.g., witness testimony) is assessed, or how this affects story evaluation. Recent empirical work suggests that people reason using qualitative causal networks. In two studies mock jurors read a real legal case and judged the probability of the defendant’s guilt, the credibility of the victim and of key witnesses. Study 1 showed that an inconsistent testimony decreased the victim’s credibility and defendant’s guilt, also increasing the defendant’s credibility. Study 2 replicated this finding with a different population. These findings suggest that people draw inferences about credibility and reliability of evidence that filter into their network of beliefs about the crime.",>Saoirse Connor Desai>David Lagnado,">City University, London, United Kingdom>University College London",https://mindmodeling.org/cogsci2015/papers/0523/index.html
2015,A holistic advantage in face drawing: higher accuracy when drawing upright faces,"This study looks into the conception that drawing or copying a face that is vertically inverted will improve the accuracy of the drawing by preventing holistic interference. We had participants draw parameterized face profiles (both upright and inverted) that were sampled from face space (see Davidenko, 2007). In each trial, participants were shown a face on the left side of the screen and asked to copy it on the right side. We then recorded the location of 66 landmark points on each face drawing, allowing us to compute a distance metric between each drawing and its corresponding original face. This distance metric served as a measure of accuracy, with higher distances corresponding to greater errors. Contrary to common belief, people's drawings were significantly more accurate for upright versus inverted faces (t(15) = 4.9; p=0.0002). Our results suggest that holistic processing improves, rather than impairs, the accuracy of face drawing.",>Jennifer Day>Nicolas Davidenko,">UCSC, Santa Cruz, CA, USA>UCSC, Santa Cruz, CA, USA",https://mindmodeling.org/cogsci2015/papers/0524/index.html
2015,Cultural Differences in Fluid Collaboration,"A common form of embodied social engagement involves acting as an ensemble, with all participants aware of each other and mutually engaged. In this naturalistic comparative study, we term this kind of triadic socio-cognitive activity ‘fluid collaboration’. Fluid collaboration occurs when participants establish the pace of ensemble activity mutually, with their moves flexibly adjusted and responsive to one another and to the demands of their shared endeavors. The moves of a fluidly collaborating ensemble depend on each other and might be described as harmonious. This kind of ensemble behavior appears to be the activity of “one organism with many limbs”. Utilizing a micro-analytic qualitative method, our finding of cultural differences in fluid collaboration relates to previous ethnographic and comparative work involving patterns of collaborative activity in Indigenous and Indigenous heritage communities in the Americas.",>Andrew Dayton>Barbara Rogoff,">University of California Santa Cruz, Santa Cruz>University of California Santa Cruz, Santa Cruz",https://mindmodeling.org/cogsci2015/papers/0525/index.html
2015,Informative Transitions: A Heuristic for Conditionalized Causal Strength Learning,"Controlling for alternative causes is essential for learning the strength of any one cause on an effect. Several processes have been proposed for how people control for alternative causes, including probabilistic contrasts within focal sets and associative processes. We investigated another mechanism called the informative transitions heuristic; people selectively attend to temporally adjacent observations (informative transitions; IT) in which the state of the target cause changes but the alternative causes remain the same. Within ITs, whether the effect also changes in the same direction, does not change, or changes in the opposite direction implies that the target cause has a positive, neutral, or negative influence on the effect. Participants judged the strength of the relationship between two drugs and a side effect in a trial-by-trial learning task. Causes with more positive as opposed to neutral ITs were judged to have stronger causal relations, consistent with the IT heuristic.",>Cory Derringer>Benjamin Rottman,">University of Pittsburgh, Pittsburgh, PA, United States>University of Pittsburgh, Pittsburgh, Pennsylvania, USA",https://mindmodeling.org/cogsci2015/papers/0526/index.html
2015,A test of the somnolent mentation theory and the cognitive shuffle insomnia treatment,"Insomnia affects about 33% of Americans according to Harvey & Tang (2003) who called for new cognitive treatments. We will report preliminary results from a test of (a) the Somnolent Mentation theory (SMT) of sleep onset (SO) and (b) a new cognitive treatment for insomnia, the cognitive shuffle (CS), derived from the SMT (Beaudoin, 2013, 2014). According to SMT, incoherent mentation characteristic of SO is not merely a side-effect of the SO period but promotes it, meaning it is somnolent. The SMT identifies several types of insomnolent mentation, which involve sense making (e.g., problem solving). SMT postulates counter-insomnolent mentation, thought patterns that interfere with insomnolent mentation. The CS is predicted to be both somnolent and counter-insomnolent (super-somnolent). Participants either engage in constructive worry Carney & Waters (2006) or in the CS using SomnoTest an iOS app developed by CogSci Apps Corp. (led by Beaudoin) based on mySleepButton®.",>Nancy Digdon>Luc Beaudoin,>MacEwan University>Simon Fraser University,https://mindmodeling.org/cogsci2015/papers/0527/index.html
2015,Natural language quantifiers are exclusively linked to exact number skills,"Knowledge of natural language quantifiers (like all, some, many) correlates with number acquisition (i.e., counting abilities). At the same time, number acquisition and approximate number skills are closely linked. These findings raise the question whether quantifier comprehension is exclusively related to exact number skills like counting or whether the relationship also extends to approximate number skills. To find out, we tested 3- to 6-year-old German speaking children on a quantifier comprehension task and on two counting tasks (‘how-many task’, ‘give-a-number task’). Additionally, we assessed children’s approximate number skills (ANS acuity) in a non-symbolic number comparison task. Quantifier comprehension was found to correlate with exact number skills even when age was controlled for. However, no significant correlation between quantifier comprehension and ANS acuity was obtained. Our findings support the notion of two distinct number systems: Only exact number skills appear to benefit from quantifier comprehension, whereas approximate number skills do not.",>Sarah Dolscheid,">University of Cologne, Cologne, NRW, Germany",https://mindmodeling.org/cogsci2015/papers/0528/index.html
2015,Acoustic Correlates of Speaker Confidence: Can They Tell I Don’t Know?,"When nervous, unprepared, or less knowledgeable about a subject area, speakers may become increasingly worried that they are revealing telling acoustic cues about their anxiety level (e.g., hesitation before speaking or vocal jitter) to their audience. The current study is a two-part (production/perception) experiment that sought to evaluate when 1) speakers produce telling acoustics and 2) listeners become sensitive to vocal confidence cues produced by the speaker. The results indicated that when a speaker produced discriminating (un)confidence cues (e.g., rising intonation and delayed speech onset), the listener was significantly better able to predict the speaker’s confidence level. Interestingly, the speaker was significantly more likely to produce discriminating acoustic cues when more social pressure was applied, suggesting that speakers may intentionally communicate information about confidence. This indicates that confidence cues may be produced for the benefit of the listener and not to the detriment of the speaker.",>Krystal Duchi>Alison Kristoff>Schea Fissel>Jennifer Roche,">Kent State University, Kent, Ohio, United States>Kent State University, Kent, Ohio, United States>Kent State University, Kent, Ohio, United States>Kent State University, Kent, Ohio, United States",https://mindmodeling.org/cogsci2015/papers/0529/index.html
2015,Influences of task difficulty on initiation time and overall use of an external strategy,"Humans readily deploy external strategies in an attempt to offload cognitive work, a process commonly referred to as cognitive offloading. For example, individuals will often rotate their head in an attempt to normalize a rotated display (i.e., external normalization). Previous work has emphasized how various manipulations affect the overall use of the behavior to better understand the underlying decision processes. This approach, however, has overlooked the potential utility in investigating how these manipulations affect the time to initiate the use of strategy. We manipulated task difficulty with upright and rotated displays and measured initiation time and the overall use of external normalization. Analyses demonstrated that when individuals rotate, rotations take the same amount of time to initiate across tasks, whereas overall frequencies of rotations varied as a function of task. This dissociation suggests that the time to initiate the strategy and external strategy selection are at least partly independent.",>Timothy Dunn>Evan Risko,">University of Waterloo, Waterloo, ON, Canada>University of Waterloo, Waterloo, ON, Canada",https://mindmodeling.org/cogsci2015/papers/0530/index.html
2015,Body-centric and world-centric components of the large-scale horizontal-vertical illusion,"In the classic horizontal vertical illusion (HVI), vertical lines appear 5-6% longer than horizontal lines. However, in outdoor scenes vertical poles of several meters appear as much as 25% longer than frontal ground extents. This large-scale HVI is consistent with angular scale expansion theory (Durgin & Li, 2011). It is known that the classic HVI is yoked to the reference frame of the eye itself, such that the illusion reverses when the observer is on his or her side. In a series of experiments conducted both in real outdoor spaces and in immersive virtual environments we examined how the large-scale HVI was affected by reorienting the observer, and found that the large scale HVI was reduced, but not reversed. The amount of reduction was quantitatively consistent with a retinotopic contribution of the classical HVI (6%). Most of the large-scale HVI is world-centric.",>Frank Durgin>Zhi Li>Brennan Klein,">Swarthmore College, Swarthmore, Pennsylvania, United States>Swarthmore College, Swarthmore, Pennsylvania, United States>Swarthmore College, Swarthmore, Pennsylvania, United States",https://mindmodeling.org/cogsci2015/papers/0531/index.html
2015,Distinguishing the Recent Past from the Complicated Present in Recognition Memory,"In the study of verbal memory, a critical question is the extent to which recognition is influenced by the prior contexts in which items have appeared (‘context noise’), as opposed to competition from other items present within the immediate task context (‘item noise’). In a standard recognition task, subjects study a list of words, and at test, discriminate between studied items (targets) and novel items (foils). To disentangle the contributions of context and item noise, we systematically manipulated both the contexts in which critical items had been encountered prior to study, and the composition of the recognition list, varying semantic similarity among items. Our results suggest independent contributions of each factor, with word frequency and temporal lag as important mediating variables. These findings can be interpreted within both associative learning and memory paradigms.",>Melody Dye>Rich Shiffrin,>Indiana University>Indiana University,https://mindmodeling.org/cogsci2015/papers/0532/index.html
2015,A Computational Model of Emotion and Personality in Mastery Motivational Oriented Students,"The capability of estimating emotions is an important feature needed for intelligent systems to interact with humans. . In this paper, we propose a computational model to calculate a user’s desirability as one of the most important emotions, especially in Intelligent Tutoring Systems (ITS). The main purpose of this research is to find a relationship between personality and desirability in virtual learning environments. The proposed model can determine the desirability of mastery motivational oriented students considering their personality, which is determined using MBTI. Based on the OCC emotion model, the goals and events are considered which can affect desirability. Then a cognitive map is developed between the personality dimensions and the goals and events. The proposed model has been implemented and evaluated in a simulated virtual learning environment and the results show that the proposed model can formulate the relationship between personality and desirability with high precision.",>Somayeh Fatahi>Hadi Moradi>Ali Nouri Zonoz,">Dalhousie University,
University of Tehran>University of Tehran>University of Tehran",https://mindmodeling.org/cogsci2015/papers/0533/index.html
2015,Can priming intuitions about the logic of sets promote logical evaluations of conjunctive probability judgments?,"Building upon the finding that people can assess the logicality of conjunctive probability statements intuitively (Vallee-Tourangeau & Faure-Bloom, 2015), we examine whether increasing the salience of people’s implicit knowledge about the logic of sets can impact the influence of logical considerations on probability judgments. We compared the rate of heuristic responding in a control group with that observed in two experimental groups where participants were either explicitly or implicitly primed to reflect on the logic of sets inclusions prior to completing a conjunction probability task. Explicit priming involved asking them to rate a series of statements such as ‘I am more likely to meet a bank teller than a bank teller who is also a feminist.’ Implicit priming involved experiencing a series of events with the co-occurring presence and absence of a target characteristic (e.g., Feminist) and an alternative characteristic (e.g., Bank Teller) using a computer-based dynamic learning task.",>Jenny Faure-Bloom>Gaëlle Vallée-Tourangeau>Frédéric Vallée-Tourangeau,">Kingston University London, Kingston Upon Thames, United Kingdom>Kingston University London, Kingston Upon Thames, United Kingdom>Kingston University London, Kingston Upon Thames, United Kingdom",https://mindmodeling.org/cogsci2015/papers/0534/index.html
2015,Interactions of emoticon valence and text processing,"Emoticons in informal text communication are common worldwide. They have the potential to reveal emotion and social functions, analogous to facial expression and body gestures in face-to-face verbal communication. Our findings from a corpus study of online text communication by a group of scientists, some of whom were bilingual and others monolingual, suggested that patterns of emoticon use depend on a variety of factors, including emoticon valence and language of texting (Aragon et al., 2014). In the present study we bring these effects into the laboratory by examining the interrelation of emoticons and words in lexical decision (LD) experiments with sequential (SOA 200 ms) but spatially superimposed emoticon-word pairs. Monolingual speakers showed a reliable interaction of emoticon valence with lexicality but interactions with word valence were unreliable. Results will be compared to those from comparable word-word pairs.",>Laurie Feldman>Kit W. Cho>Cecilia Aragon>Judith Kroll,">U Albany, SUNY & Haskins LaBS>U Albany, SUNY>U Washington>Penn State University",https://mindmodeling.org/cogsci2015/papers/0535/index.html
2015,A Triple-Stopping Threshold System For a Sequential Decision Task: A Cast-Net Stopping Rule Model,"In this study compared single stopping rules models to the Cast-Net stopping rule model. The Cast-Net model assumes that several stopping rules can be used simultaneously to determine the stopping point to stop information search and to proceed to making a final decision. We analyzed whether the Cast-net model would pay the price for being more complex when compare to single stopping rule models (critical difference, fixed-sample size and runs). The models were compared under different decision making conditions (time pressure and validity of recommendations). The model fitting procedure was conducted on the full data stopping-value distributions, by simultaneously fitting the correct and incorrect responses. Across variety of experimental conditions, the general results supported the validity of the Cast-Net model. These results challenge many decision making models that utilize only one type of a stopping rule, and may provide a new direction in the exploration of cognitive computational models.",>Mario Fific>Marcus Buckmann,">Grand Valley State University, Allendale, MI, USA>Max Planck Institute for Human Development",https://mindmodeling.org/cogsci2015/papers/0536/index.html
2015,16-month-olds use language to generate expectations about the visual world,"The capacity to use language to form new representations and to revise existing knowledge is a crucial aspect of human cognition. Here we examined whether infants can use language to adjust their existing representation of a recently encoded scene. Using an eye-tracking paradigm, we asked if 16-month-old infants (N = 26; mean age: 16;03, range: 14;15-17;15) use new linguistic information about an occluded event to inform their expectation about what the visual world should look like. We compared looking time to outcomes that matched this information to those that did not. Infants looked significantly longer when the outcome did not match the input, suggesting that they generated an expectation of the outcome based on language alone. This effect was unrelated to infants’ vocabulary size. Thus, using language to form expectations about the visual world is present at an early developmental stage, even when language skills are rudimentary.",>Allison Fitch>Patricia Ganea>Paul Harris>Zsuzsa Kaldy,">University of Massachusetts Boston, Boston, Massachusetts, United States>University of Toronto>Harvard University>University of Massachusetts Boston",https://mindmodeling.org/cogsci2015/papers/0537/index.html
2015,Text Analytic Techniques in Survey Questionnaire Development and Analysis,"This research develops three text analytic techniques to improve survey questionnaires. The first is open-ended response mining. Narrative responses on a survey are mined for themes then used to develop new questions. Closed-ended responses identify subgroups who agree/disagree with the question. Then open-ended responses examined for systematic differences which suggest new constructs that distinguish the groups. The second is used during question development. Agree/disagree questions are examined for similarity in language using latent semantic analysis. The matrix of similarity coefficients is used to make scale assembly and predicted item performance decisions in advance of field test data. The third involves replacing zero with LSA-derived coefficients as baseline comparisons for correlation coefficients to identify interesting relationships between rating questions. Semantic similarity of question stems suggests a degree of relationship between questions. This, rather than zero, is the appropriate expected value of a correlation between two items.",>John Ford,>U.S. Merit Systems Protection Board,https://mindmodeling.org/cogsci2015/papers/0538/index.html
2015,Wisdom of Randomly Assembled Small Crowds,"Policy decisions on political, economic, legal, and health issues are often made by groups that rarely exceed 40 members and are typically much smaller. Given that wisdom is usually attributed to large crowds, should committees be larger? Using computer simulations and mathematical analyses we show that group accuracy, averaged across the range of difficulty that would be encountered in real-world tasks, is often maximized for moderate-sized groups. The result holds whenever the accuracy in easy tasks is above chance more than the accuracy in difficult tasks is below chance and the easy tasks are encountered more often. Note that for the result to hold, it is not necessary to assume selective sampling of group members according to their individual accuracy. A smaller committee that would produce more accurate decisions in our model can simply be selected randomly out of a larger group of experts.",>Mirta Galesic>Daniel Barkoczi>Konstantinos Katsikopoulos,>Max Planck Institute for Human Development & Santa Fe Institute>Max Planck Institute for Human Development>Max Planck Institute for Human Development,https://mindmodeling.org/cogsci2015/papers/0539/index.html
2015,Using Advance Organizers to Improve Learning from Video,"The use of video for instructional purposes has exploded online, but little is known about how people interact with video differently than other instructional materials and how much they learn from those lessons. Kintsch’s (1994) model of text comprehension provides a productive model for studying how students build a semantic representation of materials that unfold over time but have an overarching conceptual structure. The current study seeks to replicate an earlier finding from the text comprehension literature (Mannes & Kintsch, 1987) that providing students with an informational outline before reading text can improve recall of the text and/or transfer of ideas in the texts to new contexts, depending on the structural relationship of the outline to the text itself (consistent or inconsistent structure). This study was replicated using instructional videos rather than texts. Results will be discussed with respect to Mannes and Kintsch’s original study.",>Emma Geller>James Stigler,>UCLA>UCLA,https://mindmodeling.org/cogsci2015/papers/0540/index.html
2015,The effects of spatial anxiety on memory for spatio-temporal scale,"Previous literature has shown that spatial anxiety relates to navigation abilities (Hund & Gill, 2014). How spatial anxiety effects the spatial-temporal perception of one’s environment is not well known. The present student aimed to examine how spatial anxiety related to the memory of distances and time to landmarks in the surrounding area. Participants completed a battery of navigation questionnaires and reported how far (both in distance and time) different known landmarks in the surrounding area were. Data show a trend suggesting that females overestimated distances whereas males were more accurate in estimates to the five furthest landmarks. Spatial anxiety did not predict distance estimates; however, mobility within the surrounding area was marginally predictive of distance estimates for females. These findings suggest that spatial anxiety does not predict the remembered distances and time estimates to landmarks, but that mobility may be a more important predictive factor in remembered distances to landmarks.",>Devin Gill>Jeanine Stefanucci>Sarah Creem-Regehr>Erica Barhorst,">University of Utah, Salt Lake City, UT, USA>University of Utah, Salt Lake City, UT, USA>University of Utah, Salt Lake City, UT, USA>University of Utah, Salt Lake City, UT, USA",https://mindmodeling.org/cogsci2015/papers/0541/index.html
