Year,Title,Abstract,Authors,Affiliations,URL
2015,Preschoolers' and Chimpanzees' Use of Source Reliability on Action-Based Tasks,"One way to optimize social learning is to be selective when choosing from what sources to accept information. Preschoolers prefer to learn from previously accurate or competent sources, rather than from unreliable ones (e.g., Koenig, Clément, & Harris, 2004). The current study extends this work by comparing the ability to monitor an actor’s success in two species: children and chimpanzees. Members of both species saw two actors try to open containers, with different outcomes. Then, a forced-choice response was used to determine whether participants would pair the container with the previously successful actor. While preschoolers correctly elicited help from a previously successful actor, chimpanzees did not reliably select the type of object the actor could open. The current findings suggest a difference between humans and chimpanzees’ use of past source reliability, which may reflect or result from differences in their use of social learning.",>Melissa Hrabic>Bethany MacDonald>Michael Beran>Rebecca Williamson,">Georgia State University, Atlanta, Georgia, USA>Georgia State University,  Atlanta, Georgia, USA>Language Research Center, Georgia State University, Atlanta, Georgia, USA>Georgia State University, Atlanta, Georgia, USA",https://mindmodeling.org/cogsci2015/papers/0170/index.html
2015,Can children balance the size of a majority with the quality of their information?,"We investigate how children balance the quality of informants’ knowledge with the number of endorsements, to decide which of two boxes contains the better option. When group numbers are equal, children choose boxes endorsed by informants with visual access over informants with hearsay (Experiment 1), but are at chance when group size conflicts with quality of knowledge (Experiments 2 and 3). This suggests that children tend to conform to a majority opinion, compared to adults (Experiment 4) and a normative computational model. These studies suggest that preschoolers consider the testimony of multiple informants and evaluate their knowledge sources, but may assume that informants are more individually informative than they are.",>Jane Hu>Andrew Whalen>Daphna Buchsbaum>Tom Griffiths>Fei Xu,">University of Washington>University of St Andrews>University of Toronto>University of California, Berkeley>University of California, Berkeley",https://mindmodeling.org/cogsci2015/papers/0171/index.html
2015,A Resource-Rational Approach to the Causal Frame Problem,"The causal frame problem is an epistemological puzzle about how the mind is able to disregard seemingly irrelevant causal knowledge, and focus on those factors that promise to be useful in making an inference or coming to a decision. Taking a subject’s causal knowledge to be (implicitly) represented in terms of directed graphical models, the causal frame problem can be construed as the question of how to determine a reasonable ""submodel"" of one’s ""full model"" of the world, so as to optimize the balance between accuracy in prediction on the one hand, and computational costs on the other. We propose a framework for addressing this problem, and provide several illustrative examples based on HMMs and Bayes nets. We also show that our framework can account for some of the recent empirical phenomena associated with alternative neglect.",>Thomas Icard>Noah Goodman,>Stanford University>Stanford University,https://mindmodeling.org/cogsci2015/papers/0172/index.html
2015,Beliefs about desires: Children's understanding of how knowledge and preference influence choice.,"Knowledgeable agents always choose what they like best, thus revealing their preferences. But naïve agents only choose what they believe they like best, and may end up disliking their choice. As such, sensitivity to an agent’s prior experience is critical for interpreting their behavior. Here we show that four- and five-year-olds expect knowledgeable agents, as compared to naïve agents, to have stable choices that lead to higher rewards (Experiments 1 and 2). Additionally, we show that four- and five-year-olds can infer which of two agents is naïve given information about the rewards they obtained and the stability of their choices (Experiments 3 and 4). These results show that young children understand that beliefs and desires are interconnected and that, in addition to having uncertainty about the world, agents can also be uncertain about their own desires.",>Julian Jara-Ettinger>Emily Lydic>Josh Tenenbaum>Laura Schulz,">Massachusetts Institute of Technology, Cambridge, Massachusetts>Massachusetts Institute of Technology>Massachusetts Institute of Technology>Massachusetts Institute of Technology",https://mindmodeling.org/cogsci2015/papers/0173/index.html
2015,The naïve utility calculus: Joint inferences about the costs and rewards of actions,"The understanding that agents have goals, and the ability to infer them, is fundamental in social cognition. However, much of our social understanding goes beyond goal attribution. Drawing on both behavioral studies throughout development, and on the limitations of past models, we propose that humans have a naïve utility calculus to reason about the costs and rewards underlying agents’ goals. We show that the naïve utility calculus model, embedded in a Bayesian framework, can jointly infer the costs and rewards of agents navigating in complex scenarios. Using this model we test humans’ ability to make quantitative cost-reward inferences in scenarios with various sources of costs and rewards. Our results suggest the naïve utility calculus model fits human inferences better than simple goal inference models.",>Julian Jara-Ettinger>Laura Schulz>Josh Tenenbaum,">Massachusetts Institute of Technology, Cambridge, Massachusetts, United States>MIT>MIT",https://mindmodeling.org/cogsci2015/papers/0174/index.html
2015,Task-General Object Similarity Processes,"The similarity between objects is judged in a wide variety of contexts from visual search to categorization to face recognition. There is a correspondingly rich history of similarity research and many known behavioral trends and models of similarity. Nevertheless, most similarity behaviors have been identified and tested only in a comparatively narrow set of unique contexts. This leaves open the question of the extent to which similarity judgments rely on common processes or resources and the specific nature of those processes if so. We tested three diverse yet well-established measures of object similarity using identical, psychometrically controlled stimuli and identical analyses across tasks. We found several consistent behavioral effects across tasks that provide clues as to the nature of task-general similarity processes and serve as diagnostic targets for computational models of similarity.",>Gavin Jenkins>Larissa Samuelson>John Spencer,>University of Iowa>University of Iowa>University of Iowa,https://mindmodeling.org/cogsci2015/papers/0175/index.html
2015,The Standard Theory of Conscious Perception,"In this paper I argue that the prioritization of sensory input by top-down attention is constitutive of and essential to conscious perception. Specifically, I argue that top-down attention is required to provide informational integration at the level of the subject, which can be contrasted with integration at the level of features and objects. Since the informational content of conscious perception requires integration at the level of the subject, top-down attention is necessary for conscious perception as we know it. I present this argument through a theory, which I call the “Standard Theory.” According to this theory, top-down attention brings about subject-level integration for sensory input by prioritizing that input with respect to a subject-level standard.",>Carolyn Jennings,">University of California, Merced, California, United States",https://mindmodeling.org/cogsci2015/papers/0176/index.html
2015,Mere Newness Bias,"We examine a “mere newness bias,” a preference for novelty purely due to recentness of release. In a series of studies, we show that, for newer and older products of identical quality, people prefer newly released goods over older goods across a range of domains. This bias translates to a higher willing to pay, greater anticipated excitement, and higher likelihood of purchase for products perceived to be newer. The mere newness bias persists even for die rolls, where there cannot be any difference in quality and where there is no social benefit to newness.",>Yun Jie>Ye Li,">University of California, Riverside>University of California, Riverside",https://mindmodeling.org/cogsci2015/papers/0177/index.html
2015,Similarity and Variation in the Distribution of Spatial Expressions Across Three Languages,"Languages universally encode spatial relationships between objects. However, speakers employ a variety of different language-specific expressions, which may encode culture-specific information about objects and/or different spatial concepts. We ask whether aspects of the encoding of spatial relations across languages nevertheless show common underlying spatial concepts as reflected in the distributions of spatial expressions over spatial sub-types. We examine a set of hypothesized distinctions within the spatial relational concepts of Containment and Support across three typologically distinct languages: English, Hindi, and Mandarin. We find support for two related hypotheses concerning common patterns of variation in (a) speakers' use of select ""basic"" spatial expressions, and (b) languages' inventory and distribution of expressions across hypothesized Containment and Support subtypes. The results underscore the presence of strong universal similarities in both the extension of basic spatial expressions across relations and in the principles governing the diversity of expressions available for encoding particular relations.",>Kristen Johannes>Jenny Wang>Anna Papafragou>Barbara Landau,">Johns Hopkins University, Baltimore, Maryland, United States>Johns Hopkins University, Baltimore, MD, USA>University of Delaware, Newark, DE, USA>Johns Hopkins University, Baltimore, MD, USA",https://mindmodeling.org/cogsci2015/papers/0178/index.html
2015,Predictions from Uncertain Beliefs,"According to probabilistic theories of higher cognition, beliefs come in degrees. Here, we test this idea by studying how people make predictions from uncertain beliefs. According to the degrees-of-belief theory, people should take account of both high- and low-probability beliefs when making predictions that depend on which of those beliefs are true. In contrast, according to the all-or-none theory, people only take account of the most likely belief, ignoring other potential beliefs. Experiments 1 and 2 tested these theories in explanatory reasoning, and found that people ignore all but the best explanation when making subsequent inferences. Experiment 3A extended these results to beliefs fixed only by prior probabilities, while Experiment 3B found that people can perform the probability calculations when the needed probabilities are explicitly given. Thus, people’s intuitive belief system appears to represent beliefs in a ‘digital’ (true or false) manner, rather than taking uncertainty into account.",>Samuel Johnson>Thomas Merchant>Frank Keil,">Yale University, New Haven, CT, United States>Brown University>Yale University, New Haven, CT, United States",https://mindmodeling.org/cogsci2015/papers/0179/index.html
2015,Belief Utility as an Explanatory Virtue,"Our beliefs guide our actions. But do potential actions also guide our beliefs? Three experiments tested whether people use pragmatist principles in fixing their beliefs, by examining situations in which the evidence is indeterminate between an innocuous and a dire explanation that necessitate different actions. According to classical decision theory, a person should favor a prudent course of action in such cases, but should nonetheless be agnostic in belief between the two explanations. Contradicting this position, participants believed the dire explanation to be more probable when the evidence was ambiguous. Further, when the evidence favored either an innocuous or a dire explanation, evidence favoring the dire explanation led to stronger beliefs compared to evidence favoring the innocuous explanation. These results challenge classic theories of the relationship between belief and action, suggesting that our system for belief fixation is sensitive to the utility of potential beliefs for taking subsequent action.",>Samuel Johnson>Greeshma Rajeev-Kumar>Frank Keil,">Yale University, New Haven, CT, United States>Yale University, New Haven, CT, United States>Yale University, New Haven, CT, United States",https://mindmodeling.org/cogsci2015/papers/0180/index.html
2015,Argument Scope in Inductive Reasoning: Evidence for an Abductive Account of Induction,"Our ability to induce the general from the specific is a hallmark of human cognition. Inductive reasoning tasks ask participants to determine how strongly a set of premises (e.g., Collies have sesamoid bones) imply a conclusion (Dogs have sesamoid bones). Here, we present evidence for an abductive theory of inductive reasoning, according to which inductive strength is determined by treating the conclusion as an explanation of the premises, and evaluating the quality of that explanation. Two inductive reasoning studies found two signatures of explanatory reasoning, previously observed in other studies: (1) an evidential asymmetry between positive and negative evidence, with observations casting doubt on a hypothesis given more weight than observations in support; and (2) a latent scope effect, with ignorance about potential evidence counting against a hypothesis. These results suggest that inductive reasoning relies on the same hypothesis evaluation mechanisms as explanatory reasoning.",>Samuel Johnson>Thomas Merchant>Frank Keil,">Yale University, New Haven, CT, United States>Brown University>Yale University, New Haven, CT, United States",https://mindmodeling.org/cogsci2015/papers/0181/index.html
2015,Probabilistic Versus Heuristic Accounts of Explanation in Children: Evidence from a Latent Scope Bias,"Like scientists, children must find ways to explain causal systems in the world. The Bayesian approach to cognitive development holds that children evaluate explanations by applying a normative set of statistical learning and hypothesis-testing mechanisms to the evidence they observe. Here, we argue for certain supplements to this approach. In particular, we demonstrate in two studies that children, like adults, have a robust latent scope bias that conflicts with the laws of probability. When faced with two explanations equally consistent with observed data, where one explanation made an unverified prediction, children consistently preferred the explanation that did not make this prediction (Experiment 1). The bias can be overridden by strong prior odds, indicating that children can integrate cues from multiple sources of evidence (Experiment 2). We argue that children, like adults, rely on heuristics for making explanatory judgments which often lead to normative responses, but can lead to systematic error.",>Angie Johnston>Samuel Johnson>Marissa Koven>Frank Keil,">Yale University, New Haven, CT, United States>Yale University, New Haven, CT, United States>Emory University>Yale University, New Haven, CT, United States",https://mindmodeling.org/cogsci2015/papers/0182/index.html
2015,Interruption-recovery training transfers to novel tasks,"Interruption interference is a significant decrease in performance following task interruption. This interference is often studied using primary and interrupting task pairs. Evidence suggests that interruption interference can be reduced through practice by exposing individuals to many interruptions. However, evidence that this skill transfers beyond the tasks being trained is less clear. In particular, these practice effects may only occur when the same interrupting/primary task pairs are involved. A transfer paradigm was implemented to assess the transfer of interruption-recovery skill. Participants in separate conditions performed either the Tower of Hanoi or the Tower of London primary task during a training block and a transfer block of trials. Trials were interrupted by another task, and the primary measure was the time taken to resume the interrupted task. Significantly lower resumption times at the beginning of the transfer block lead to the conclusion that interruption recovery skill can transfer to novel tasks.",>Winston Jones>Jarrod Moss,">Mississippi State University, Starkeville, MS, United States>Mississippi State University",https://mindmodeling.org/cogsci2015/papers/0183/index.html
2015,Organizing Metacognitive Tutoring Around Functional Roles of Teachers,"Metacognitive skills are critical in learning but difficult to teach. Thus the question becomes how can we facilitate metacognitive tutoring? We present an exploratory learning environment called MILA-T with embedded metacognitive tutors imitating five functional roles of teachers in classrooms. We tested MILA–T in a controlled experiment with 237 middle school students. We examine the impact of MILA–T on the models of a natural phenomenon constructed by the students. We find that students with access to MILA–T wrote better evidential justifications for their models, and thus, deliver better-justified models for the phenomenon. We also find that these improvements persisted during a transfer task. These results lend support for organizing metacognitive tutoring around the functional roles of teachers for supporting inquiry-driven modeling.",>David Joyner>Ashok Goel,>Georgia Institute of Technology>Georgia Institute of Technology,https://mindmodeling.org/cogsci2015/papers/0184/index.html
2015,Analyzing the Predictability of Lexeme-specific Prosodic Features as a Cue to Sentence Prominence,"This study investigates the relationship between sentence prominence and the predictability of word-specific statistical descriptors of prosody. We extend from an earlier word-invariant model by studying a model that marks words as prominent if the acoustic prosodic features differ from their expected values during the lexemes. To test the approach, the most common acoustic features associated with the perception of prominence are extracted and several lexeme-specific statistical measures are computed for each feature. Simulations are conducted on a corpus of continuous English speech and the algorithm output is compared to manually assigned prominence labels. The results show that the deviant prosodic descriptors of the words correlate with the perception of prominence. However, this effect is much smaller than that obtained by modeling the prosodic predictability at the utterance level, suggesting that context-independent lexeme-specific models are unable to capture relevant aspects of sentence prominence.",>Sofoklis Kakouros>Okko Johannes Räsänen,">Aalto University, Department of Signal Processing and Acoustics, Espoo, Finland>Aalto University, Department of Signal Processing and Acoustics, Espoo, Finland",https://mindmodeling.org/cogsci2015/papers/0185/index.html
2015,Young Children’s Understanding of the Successor Function,"This study examined 4-year-old children’s understanding of the successor function, the concept that for every positive integer there is a unique next integer. Children were tested in the context of cardinal numbers and ordinal numbers. The results suggest that knowledge of the successor for cardinal numbers precedes that for ordinal numbers. In addition, for both cardinal and ordinal numbers, children generally failed to demonstrate understanding that the successor of a given number is unique.",>Jennifer Kaminski,>Wright State University,https://mindmodeling.org/cogsci2015/papers/0186/index.html
2015,Let’s talk (ironically) about the weather: Modeling verbal irony,"Verbal irony plays an important role in how we communicate and express opinions about the world. While there exist many theories and empirical findings about how people use and understand verbal irony, there is to our knowledge no formal model of how people incorporate shared background knowledge and linguistic information to communicate ironically. Here we argue that a computational approach previously shown to model hyperbole (Kao, Wu, Bergen, & Goodman, 2014) can also explain irony once we extend it to a richer space of affective subtext. We then describe two behavioral experiments that examine people's interpretations of utterances in contexts that afford irony. We show that by minimally extending the hyperbole model to account for two dimensions of affect---valence and arousal---our model produces interpretations that closely match humans'. We discuss the implications of our model on informal theories of irony and its relationship to other types of nonliteral language understanding.",>Justine Kao>Noah Goodman,>Stanford University>Stanford University,https://mindmodeling.org/cogsci2015/papers/0187/index.html
2015,What is the Role of Conceptual Analysis in Cognitive Science?,"Cognitive scientists sometimes find themselves embroiled in debates over the precise definitions of high-level concepts in their fields – COGNITION, EMOTION, SENSE, and so on. The idea behind these debates seems to be that achieving a precise definition of these concepts will be a boon to scientific inquiry. We argue that these efforts of conceptual analysis would benefit from greater appreciation of the importance of such high-level concepts in supporting association or semantic priming, as opposed to deduction. In this associative role, they provide the basis for making connections between related concepts, connections that can then be explored by empirical methods, which in turn yield more precise, but often quite novel, concepts. In combination with well-established work in cognitive psychology on the non-classical structure of natural concepts, this perspective suggests that researchers should be cautious about investing substantial time and energy in attempts to precisely define concepts like COGNITION.",>Liam Kavanagh>Christopher Suhler,">University of California, San Diego, La Jolla, CA, USA>University of California, San Diego, La Jolla, CA, USA",https://mindmodeling.org/cogsci2015/papers/0188/index.html
2015,Pronominal Reference and Pragmatic Enrichment: A Bayesian Account,"A standard assumption in research on pronoun use is that production and interpretation are guided by the same set of contextual factors. Kehler et al. (2008) and Kehler & Rohde (2013) have argued instead for a Bayesian model, according to which pronoun production is insensitive to a class of semantic and pragmatic biases that have been shown to influence interpretation. We evaluate the model using a passage completion study that employs a contextual manipulation to which traditional analyses are insensitive, specifically by varying whether a relative clause that modifies the direct object in the context sentence invites the inference of a cause. The results support the claim that pronoun interpretation biases, but not production biases, are sensitive to this pragmatic enrichment, revealing the asymmetry predicted by the Bayesian analysis. A correlation analysis further establishes that the model provides better estimates of measured pronoun interpretation biases than two competing models.",>Andrew Kehler>Hannah Rohde,">University of California, San Diego>University of Edinburgh",https://mindmodeling.org/cogsci2015/papers/0189/index.html
2015,Resolving Rogers’ Paradox with Specialized Hybrid Learners,"Culture is considered an evolutionary adaptation that enhances human reproductive fitness. A common explanation is that social learning, the learning mechanism underlying cultural transmission, enhances fitness by avoiding the extra costs of individual learning. This explanation was disproved by a mathematical model of individual and social learning, showing that social learners can invade a population but do not enhance its fitness. We extend this model to include a more complex environment, limited cognitive resources, and hybrid learners that combine social and individual learning. In this extended model, we show that social learning evolves and enhances population fitness via hybrid learners capable of specializing their individual learning.",>Milad Kharratzadeh>Marcel Montrey>Alex Metz>Thomas Shultz,">McGill University, Montreal, Quebec, Canada>McGill University, Montreal, Quebec, Canada>McGill University, Montreal, Quebec, Canada>McGill University, Montreal, Quebec, Canada",https://mindmodeling.org/cogsci2015/papers/0190/index.html
