Year,Title,Abstract,Authors,Affiliations,URL
2015,"Applying for National Science Foundation Funding in Cognitive Science: Cognition, Computation, Development, Education, and Neuroscience","This half-day workshop will provide information and hands- on experience related to applying for National Science Foundation (NSF) funding in cognitive science. Program officers will discuss the NSF review process and NSF merit criteria. Details regarding a range of cognitive science research programs will be covered, including cognition, computation, development, education, and neuroscience. In addition, as an interactive activity, attendees will participate in simulated review panels using actual cognitive science grant proposals.",>Anne Cleary>Hector Avila-Munoz>Evan Heit>Chris Hoadley>Laura Namy>Alumit Ishai>Betty Tuller,>NSF>NSF>NSF>NSF>NSF>NSF>NSF,https://mindmodeling.org/cogsci2015/papers/0001/index.html
2015,Physical and Social Scene Understanding,"Computer vision has made significant progress in locating and recognizing objects in real images. However, beyond the scope of this “what is where” challenge, it lacks the abilities to understand scenes characterizing human visual experience. The mission of this workshop is to (a) identify the key domains in which human visual perception and cognition outperform computer vision; (b) formalize the computational challenges in these domains; and (c) provide promising frameworks for solving these challenges by conducting cognitive science and computer vision studies. We propose FPIC as four key domains beyond “what is where”: Functionality (e.g., what can be done with this slotted spoon?) Physics (e.g., will the spoon be able to pick up the meatball?) Intentionality (e.g., is the person trying to scoop up the cheese or point toward it?) Causality (e.g., why does the gravy pass through the spoon?)",>Tao Gao>Yibiao Zhao>Lap-Fai Yu,">MIT>UCLA, Los Angeles, CA, United States>University of Massachusetts",https://mindmodeling.org/cogsci2015/papers/0002/index.html
2015,"Language & common sense: Integrating across psychology, linguistics, and computer science","The language understanding that underlies state-of-the-art Internet search, machine translation, and dictation software is undeniably impressive. Equally undeniable is that these systems do not really understand language. What is missing? One candidate is common sense. Language is a mechanism for moving ideas from one mind to another -- ideas that are meant to be understood in the context of pre-existing, interlocking beliefs. Thus, fully exploiting its power may require sophisticated, explicit representations of world knowledge -- that is, common sense.",>Joshua Hartshorne>Joshua Tenenbaum,>MIT>MIT,https://mindmodeling.org/cogsci2015/papers/0003/index.html
2015,Evidence Accumulation Modeling: Bayesian Estimation using Differential Evolution,"Understanding decision making requires a dynamic approach that accounts for the time taken to make choices as well as the choices that are made. The success of the dynamic approach is underpinned by cognitive models, such as the drift-diffusion model (DDM: Ratcliff & McKoon, 2008) and linear ballistic accumulator (LBA: Brown & Heathcote, 2005, 2008), that attribute decisions to an evidence accumulation processes. The ability of these models, and elaborations of them, to account for the speed and accuracy with which people make decisions across a broad range of tasks has led to an increasing number of applications in Cognitive Science and Neuroscience (for recent examples see Cassey, Heathcote & Brown, 2014; Heathcote, Loft & Remington, in press; Mittner et al., 2014; Turner, Van Maanen, Forstmann, in press).",>Andrew Heathcote>Brandon Turner Turner>Scott Brown,">The University of Tasmania>The Ohio State University>The University of Newcastle, Australia",https://mindmodeling.org/cogsci2015/papers/0004/index.html
2015,"Workshop on Optimizing Experimental Designs: Theory, Practice, and Applications","The accurate and efficient measurement of observations is at the core of empirical scientific research. To ensure measurement is optimal, and thereby maximize inference, there has been a recent surge of interest among researchers in the design of experiments that lead to rapid accumulation of information about the phenomenon under study with the fewest possible measurements. Statisticians have contributed to this area by introducing methods of optimizing experimental design (OED). The methodology involves adapting the experimental design in real time as the experiment progresses. The purpose of this full-day workshop is to introduce the principles underlying OED, illustrate how to apply OED in practice using widely and freely available software tools (e.g., R) to showcase applications of OED in areas such as cognitive psychology, education and assessment, and machine learning, and provide a platform to share work on OED.",>Jay Myung>Mark Pitt>Maarten Speekenbrink,>Ohio State University>Ohio State University>University College London,https://mindmodeling.org/cogsci2015/papers/0005/index.html
2015,Quantifying the Dynamics of Interpersonal Interaction: A Primer on Cross-Recurrence Quantification Analysis using R,"Over the last decade, the dynamics of interpersonal interaction has become a growing topic in cognitive science, precisely because of the important implications that interpersonal dynamics carry on shaping our ‘social cognitive system.’ Many important advances on this research topic have been possible through the application of concepts and statistical methods, which provide quantification for the dynamic structure of cognitive responses observed when individuals interact such as Recurrence Quantification Analysis (RQA). In this tutorial, cognitive scientists from different fields, and at different stages of their career will learn a dynamical systems framework to interpret and understand interpersonal interaction, and acquire the analytical principles of C/RQA, which helps framing this approach.",>Moreno I. Coco>Rick Dale,">University of Lisbon, Lisbon, Portugal>University of California, Merced",https://mindmodeling.org/cogsci2015/papers/0006/index.html
2015,Programming online experiments with jsPsych,"This tutorial is an introduction to jsPsych, which is a free and open-source software package for creating experiments that run in a web browser. Participants in the tutorial will learn how to build an experiment using jsPsych, and how to extend and customize jsPsych for novel experimental paradigms.",>Josh de Leeuw,">Indiana University, Bloomington, IN, USA",https://mindmodeling.org/cogsci2015/papers/0007/index.html
2015,Tutorial: Bayesian data analysis,"Bayesian data analysis is superseding traditional methods in sciences from anthropology to zoology. Bayesian methods solve many problems inherent in p values and confidence intervals. More importantly, Bayesian methods are more richly and intuitively informative. Bayesian analysis applies flexibly and seamlessly to simple situations or complex hierarchical models and realistic data structures, including small samples, large samples, unbalanced designs, missing data, censored data, outliers, etc. Bayesian analysis software is flexible and can be used for a wide variety of data-analytic and psychometric models. This full-day tutorial presents a ground-level, hands-on introduction to doing Bayesian data analysis. The presenter is an award-winning teacher who has honed new materials from many previous courses. He has written an acclaimed textbook on the topic, now greatly expanded in its second edition. The tutorial materials include free software and numerous programs that can be used for real data analysis.",>John Kruschke,">Indiana University, Bloomington, Indiana, USA",https://mindmodeling.org/cogsci2015/papers/0008/index.html
2015,Full Day Tutorial on Quantum Models of Cognition and Decision,"This tutorial covers the rapidly growing new approach to building computational models of cognition based on quantum theory. The cognitive revolution that occurred in the 1960’s was based on classical computational logic, and the connectionist movements of the 1970’s were based on classical dynamical systems. These classical assumptions remain at the heart of both cognitive architecture and neural network theories, and they are so commonly applied that we take them for granted and presume them to be true. What are these critical but hidden assumptions upon which traditional theories rely? Quantum theory provides a fundamentally different approach to logic, reasoning, probabilistic inference, and dynamical systems. For example, quantum logic does not follow the distributive axiom of Boolean logic, and quantum probabilities do not obey the disjunctive axiom of Kolmogorov probability. It turns out that humans do not obey these restrictions either, which is why we consider a quantum approach.",>Jennifer Trueblood>James Yearsley>Zheng Wang>Jerome Busemeyer,">University of California, Irvine, Irvine, California, USA>City University, London, United Kingdom>The Ohio State University, Columbus, OH, U.S.>Indiana University",https://mindmodeling.org/cogsci2015/papers/0009/index.html
2015,"Connecting learning, memory, and representation in math education","In math education the goal is for children not only to master the materials and problems presented, but to understand underlying principles and properties that can be applied broadly to new problems and situations. Teachers in the classroom and policy-makers in Washington thus are both faced with what is essentially a cognitive question: What instructional regimes and practices will produce rapid learning, deep understanding, and broad transfer?",>Martha Alibali>Chuck Kalish>Timothy Rogers>Christine Massey>Phil Kellman>Vladimir Sloutsky>James L. McClelland>Kevin Mickey,>University of Wisconsin  Madison>University of Wisconsin Madison>University of Wisconsin Madison>University of Pennsylvania>UCLA>Ohio State University>Stanford University>Stanford University,https://mindmodeling.org/cogsci2015/papers/0010/index.html
2015,Causality and Agency Across Cultures and Languages,"Why does wood float on water? What made Jim shout at me, and why had he to be so offending? Who is responsible for my son’s sickness? And why should incest be wrong? All these questions share one important feature: They ask for causal explanations. Causality is a core concept in our attempts to make sense of the physical world and of social interactions; and this makes causal cognition a topic of prime interest for cognitive science. Yet, in spite of an increasing body of high-quality and high-profile research, most previous studies paid only incidental attention to the potential of cognitive and linguistic diversity in causal cognition.",>Sieghard Beller>Andrea Bender>Jürgen Bohnemeyer>Annelie Rothe-Wulf>York Hagmayer>Rita Astuti,">University of Bergen, Norway>University of Bergen, Norway>University at Buffalo SUNY, USA>University of Freiburg, Germany>University of Göttingen, Germany>London School of Economics, London, UK",https://mindmodeling.org/cogsci2015/papers/0011/index.html
2015,Communicating Cognitive Science: Improving Awareness and Understanding Among People Who are Not Ourselves,"As cognitive scientists, we invest enormous amounts of time in our graduate educations and careers learning to communicate our findings to others in the form of highly specialized research papers. Indeed, it is hard to imagine how the nuance and distinctions required to advance our science, or any science, could be communicated if such were not the case. However, our work is a public enterprise that is largely sustained by institutions that promise some return to the public good. In other fields, this return may be primarily in terms of ideas and insight into the human condition, as might be the case for archaeology and history. The return may be in new discoveries regarding our physical world, such as recent progress in nanomaterials that promise eventual translation into new forms of energy, transportation, and communication. Or it may be focused on the Pasteur’s Quadrant of research addressing a practical need.",>Kevin Gluck>Wayne Gray>Marsha Lovett>Art Markman>Jim Spohrer,">Air Force Research Laboratory>Rensselaer Polytechnic Institute, Troy, New York, United States>Carnegie Mellon University>University of Texas>IBM, San Jose, CA, United States",https://mindmodeling.org/cogsci2015/papers/0012/index.html
2015,Generative and Discriminative Models in Cognitive Science,"One popular distinction in machine learning is between discriminative and generative models (Ng & Jordan, 2001). Given the cross fertilization between research in human and machine learning, the time is ripe to ask whether the mind is a generative or discriminative learning device. This symposium tackles this question from a variety of perspectives. The aim is to explore the explanatory value of these two basic views of learning, which cut across existing distinctions in cognitive science (e.g., connectionist vs. Bayesian approaches).",>Brad Love>Michael Ramscar>Tom Griffiths>Matt Jones,">University College London>University of Tübingen>University of California, Berkeley>University of Colorado at Boulder",https://mindmodeling.org/cogsci2015/papers/0013/index.html
2015,Analogical Processes in Language Learning,"Language acquisition is a complex task, encompassing (at least) perception and categorization of phonemes, segmentation of speech, learning word meanings, and extracting morphological and syntactic regularities. The daunting nature of this task has led many to assume that a specialized module is required for language acquisition. Yet there is increasing evidence that general learning processes play a major role (e.g., Marcus et al, 1999; Saffran, Aslin & Newport, 1996). In this symposium we present the case that analogical comparison processes play an important role in language learning. We bring together empirical work addressing language acquisition in young children and second language learners, across three different levels of linguistic structure: phonology, lexical semantics, and syntax. Taken together, these studies suggest that analogical processes are important at every level of language learning.",>Bozena Pajak>Micah Goldwater>Dedre Gentner>Adele Goldberg>Ruxue Shao,>Northwestern. University>University of Sidney>Northwestern University>Princeton University>Northwestern University,https://mindmodeling.org/cogsci2015/papers/0014/index.html
2015,The Relevance of Alternative Possibilities throughout Cognition,"Research in a number of different fields has independently argued for the importance of providing a place for modality—that is, some way of representing alternative possibilities that could have happened, but actually did not (e.g., Kratzer, 2012; Lewis, 1973; Pearl, 2000). In each of these cases, the key insight has been that people’s understanding of the things that occur is shaped in some central way by their understanding of these alternative possibilities. Work throughout these fields has emphasized that people do not treat all alternative possibilities equally. Instead, they regard certain possibilities as relevant, while treating others as irrelevant (Portner, 2009; Roese, 1997). Within this research, one consistent theme has been that norms (statistical, moral, conventional, etc.) influence how these alternative possibilities are represented.",>Jonathan Phillips>Joshua Knobe>Andrew Shtulman>Charles Kalish>Anne Riggs>Christopher Hitchcock,>Harvard University>Yale University>Occidental College>University of Wisconsin Madison>University of Wisconsin Madison>California Institute of Technology,https://mindmodeling.org/cogsci2015/papers/0015/index.html
2015,Eye-tracking situated language comprehension: Immediate actor gaze versus recent action events,"Visual-world eye-tracking findings suggest visual cues rapidly affect spoken sentence comprehension. When participants saw an actor perform an action and then listened to a related sentence (NP1-VERB-ADV-NP2), they preferentially inspected the “recent” over another “future” event target, and this even when future events were much more frequent. The current studies assessed to which extent this recent-event preference is modulated by another situation-immediate cue to the future event target (an actor’s gaze). Half of the sentences referenced a future event, and the experimenter performed one “recent” action before and one “future” action after the sentence. On 50% of the trials, he gazed at the future target object during the verb (Experiment 1) or at verb onset (Experiment 2). Results showed that gaze and future tense together cued attention to the future target; however gaze did not completely override the recent event preference.",>Dato Abashidze>Pia Knoeferle>Maria Nella Carminati,">Cognitive Interaction Technology Excellence Cluster, Department of Linguistics Bielefeld University, Germany>Cognitive Interaction Technology Excellence Cluster, Department of Linguistics Bielefeld University, Germany>Cognitive Interaction Technology Excellence Cluster, Department of Linguistics Bielefeld University, Germany",https://mindmodeling.org/cogsci2015/papers/0016/index.html
2015,Effect of heaviness on the cognitive evaluation process,"The aim of this study was to clarify how the sense of heaviness changes our cognition. According to recent studies in cognitive science, intelligent human behaviors ranging from perception to inference are not closed mental processes; rather, they are affected by body and action (Wilson, 2002; Gibbs, 2005; Proffitt, 2006). In previous studies, the sense of heaviness activated concepts metaphorically related to heaviness, and changed impressions accordingly. However, previous studies have not distinguished between subjective heaviness and physical weight. The purpose of this study was to clarify whether changes in impressions are due to subjective heaviness or physical weight. To examine this issue, a psychological experiment using a tasting task was conducted. The results confirmed that subjective heaviness influences evaluations of price and value.",>Keiga Abe,>Gifu Shotoku Gakuen University,https://mindmodeling.org/cogsci2015/papers/0017/index.html
2015,A Computational Approach to Modelling the Perception of Pitch and Tonality in Music,"The ability to extract meaningful relationships from sequences is crucial to many aspects of perception and cognition, such as speech and music. This paper explores how leading computational techniques may be used to model how humans learn abstract musical relationships, namely, tonality and octave equivalence. Rather than hard-coding musical rules, this model uses an unsupervised learning approach to glean tonal relationships from a musical corpus. We develop and test a novel input representation technique, using a perceptually-inspired harmonics-based representation, to bootstrap the model’s learning of tonal structure. The results are compared with behavioral data from listeners’ performance on a standard music perception task: the model effectively encodes tonal relationships from musical data, simulating expert performance on the listening task. Lastly, the results are contrasted with previous findings from a computational model that uses a more simple symbolic input representation of pitch.",>Kat Agres>Carlos Cancino>Maarten Grachten>Stefan Lattner,">Queen Mary, University of London, London>Austrian Research Institute for Artificial Intelligence>Austrian Research Institute for Artificial Intelligence>Austrian Research Institute for Artificial Intelligence",https://mindmodeling.org/cogsci2015/papers/0018/index.html
2015,Do potential past and future events activate the Lateral Mental Timeline?,"We tested whether potential events are represented along the lateral mental timeline. In Experiment 1 participants categorized the temporal reference of either factual or potential events and responded by means of a lateralized keypress. Factual events replicated prior findings: participants were faster to categorize past events with the left hand and future events with the right hand than when using the opposite mapping. Mainly, this also ocurred for potential events. Experiment 2 replicated this finding using pure blocks of potential events. In order to assess the automaticity of the mental timeline, Experiment 3 asked participants to judge whether the expressions referred to factual or potential events. There was no space-time congruency effect. Instead, participants faster categorized potential events with the left hand and factual events with the right hand than when using the opposite mapping, suggesting for the first time a link between the mental representations of space and potentiality.",>Roberto Aguirre>Julio Santiago,>Universidad de la República>Universidad de Granada,https://mindmodeling.org/cogsci2015/papers/0019/index.html
2015,A Rational Model for Individual Differences in Preference Choice,"Human preference choice suffers curious contextual effects: the relative preference between two multi-attribute options (e.g. cars with differing safety and economy ratings) can dramatically shift, depending on the presence/absence of additional options. This phenomenon defies any simple utility-based account of choice, and has been taken to imply irrationalities/sub-optimalities in human decision-making, or reflect idiosyncrasies in neural processing. Recently, we used a Bayesian model to show that these contextual effects are normative consequences of observers’ using options to learn about the “market"". However, it had an unsavory implication that all decision-makers asymptotically converge to the same beliefs/behavior. Here, we propose a new model that uses both market and personal utilities to make choices. This model still captures the contextual effects, while also allowing asymptotic differences in individual preferences and providing a general framework for explaining how consumption informs one's beliefs and preferences.",>Sheeraz Ahmad>Angela Yu,">University of California San Diego, San Diego, California, United States>University of California San Diego, La Jolla, CA, United States",https://mindmodeling.org/cogsci2015/papers/0020/index.html
2015,Motion event expressions in language and gesture: Evidence from Persian,"How do people conceptualize motion events and talk about them? The current study examines how gestural representations of motion events arise from linguistic expressions in Persian, which has characteristics of both Talmy’s satellite- and verb-framed languages. We examined native Persian speakers’ speech and gestures in describing 20 motion events. We focused on two motion event components: path (trajectory of motion like up) and manner (how the action is performed like jumping). Results indicated that when expressing motion, Persian speakers produced path in both speech and gesture, whereas manner was conveyed only through speech (mostly as adverbs). Additionally, dynamic gestures tended to occur in the same order they were uttered. The difference between path and manner findings asks for further research to examine language-gesture interaction in detail among different languages. Results also suggest refinement in gesture theories that argue for one-to-one correspondence between speech and gesture.",>Niloofar Akhavan>Nazbanou Nozari>Tilbe Goksun,">Koc University, Istanbul, Turkey>Johns Hopkins University, Baltimore>Koc University, Istanbul, Turkey",https://mindmodeling.org/cogsci2015/papers/0021/index.html
2015,Daxing with a Dax: Evidence of Productive Lexical Structures in Children,"In English, many words can be used flexibly to label artifacts, as nouns, or functional uses of those artifacts, as verbs (e.g., we can shovel snow with a shovel). Here, we examine whether young children form generalizations about flexibility from early in life and use such generalizations to predict new word meanings. In Experiment 1, we show that children spontaneously expected a novel verb referring to an action to also refer to the instrumental artifact used to perform that action. In Experiment 2, we show that this pattern extends to words that label novel actions involving novel artifacts, suggesting that children expect any word for an action to label the artifact that helps carry out that action. Experiment 3 traces how such generalizations may arise in development. In particular, we show that while four- and five-year-olds each expect words to label artifacts and their functions, three-year- olds may not.",>Sara Al-Mughairy>Ruthe Foushee>David Barner>Mahesh Srinivasan,">University of California, Berkeley>University of California, Berkeley, Berkeley, CA, USA>University of California, San Diego>University of California, Berkeley",https://mindmodeling.org/cogsci2015/papers/0022/index.html
