Year,Title,Abstract,Authors,Affiliations,URL
2015,Cross-situational cues are relevant for early word segmentation,"Existing models of infant word learning have mainly assumed that the learner is capable of segmenting words from speech before grounding them to their referential meaning, while segmentation itself has been treated relatively independently of meaning acquisition. In this paper, we argue that situated cues such as visually perceived concrete objects or actions are not just important for word-to-meaning mapping, but that they are useful in pre-linguistic word segmentation, thereby helping the learner to bootstrap the language learning process. We present a model where joint acquisition of proto-lexical segments and their meanings maximizes the referential quality of the lexicon, and where learning can occur without any a priori knowledge of the language or its linguistically relevant units. We investigate the behavior of the model using a computational implementation of statistical learning, showing successful word segmentation under varying degrees of referential uncertainty.",>Okko Räsänen>Heikki Rasilo,">Aalto University, Department of Signal Processing and Acoustics, Finland>Aalto University, Department of Signal Processing and Acoustics, Finland",https://mindmodeling.org/cogsci2015/papers/0337/index.html
2015,"Computational evidence for effects of memory decay, familiarity preference and mutual exclusivity in cross-situational learning","Human infants learn meanings for words in interaction with their environment. Individual learning scenarios can be ambiguous due to the presence of several words and possible meanings. One possible way to overcome ambiguity is called cross-situational learning (XSL), where information is gathered over several learning trials. Experimental studies of human XSL have shown that cognitive constraints, such as attention and memory limitations, decrease human performance when compared to computer models that can store all available information. In this paper, we approach modeling of human performance with a novel computational XSL algorithm, FAMM (Familiarity preference, Associative learning, Mutual exclusivity, Memory decay), equipped with the four main components motivated by experimental research. The model is evaluated based on a number of earlier XSL experiments that probe different aspects of learning. FAMM is shown to provide a better fit to the behavioral data than the earlier proposed model of Kachergis et al. (2012).",>Heikki Rasilo>Okko Johannes Räsänen,">Aalto University, Dept. Signal Processing and Acoustics, Espoo, Finland>Aalto University, Department of Signal Processing and Acoustics, Espoo, Finland",https://mindmodeling.org/cogsci2015/papers/0338/index.html
2015,Cognitive consequences of interactivity,"When children encounter objects, design constrains and affords action and cognition. An observational study in the wild revealed how manipulable objects afforded complexity of cognitive outcomes. Evidence comes from video analysis of children’s speech, gesture, and action when using natural history exhibits. Children spoke more about the museum’s content when they touched the exhibits, but the content of their speech changed depending on the object’s affordances for interaction. With static specimens and models, children most often referred to objects’ concrete properties. With interactive exhibits, children’s speech involved references to dynamic relations among exhibit elements. Use of abstract speech and iconic gestures also suggests that they perceived interactive exhibits as representations of objects and phenomena beyond the here-and-now. When children used interactive exhibits, the content of their speech was relational, representational, and at times, both representational and relational; they employed modes of conceptualization not seen when using non-interactive exhibits.",>Nan Renner,">University of California, San Diego",https://mindmodeling.org/cogsci2015/papers/0339/index.html
2015,Eye Movements Reveal Sensitivity to Sound Symbolism Early and Late in Word Learning,"Although the relationship between sound and meaning in language is arbitrary, reliable correspondences between sound and meaning have been found in natural language. These sound symbolic relationships affect word learning, but less is known about how sound symbolism affects online processing during learning or for well-learned stimuli. We use the visual world paradigm and an artificial lexicon featuring carefully controlled sound symbolic correspondences to examine the effects of sound symbolism on the online processing of novel and well-learned stimuli. Initially, participants chose novel shapes matching the sound symbolic properties of the word above chance, reliably fixating consistent shapes around word offset. As learning approached ceiling, accuracy and reaction time differences between matching and mismatching stimuli disappeared but a disadvantage in the online processing of mismatching stimuli persisted in the form of lagging target fixations. This suggests that sound symbolism affects the online processing of spoken stimuli even for well-learned words.",>Kate Pirog Revill>Laura Namy>Lynne Nygaard,>Emory University>Emory University>Emory University,https://mindmodeling.org/cogsci2015/papers/0340/index.html
2015,The Attentional Learning Trap and How to Avoid It,"People often make repeated decisions from experience. In such scenarios, persistent biases of choice can develop, most notably the “hot stove effect” (Denrell & March, 2001) in which a prospect that is mistakenly believed to be negative is avoided and thus belief-correcting information is never obtained. In the existing literature, the hot stove effect is generally thought of as developing through interaction with a single, stochastic prospect. Here, we show how a similar bias can develop due to people’s tendency to selectively attend to a subset of features during categorization. We first explore the bias through model simulation, then report on an experiment in which we find evidence of a decisional bias linked to selective attention. Finally, we use these computational models to design novel interventions to “de-bias” decision-makers, some of which may have practical application.",>Alexander Rich>Todd Gureckis,>New York University>New York University,https://mindmodeling.org/cogsci2015/papers/0341/index.html
2015,What defines a category? Evidence that listeners’ perception is governed by generalizations,"Listeners draw on their knowledge of phonetic categories when identifying speech sounds, extracting meaningful structural features from auditory cues. We use a Bayesian model to investigate the extent to which their perceptions of linguistic content incorporate their full knowledge of the phonetic category structure, or only certain aspects of this knowledge. Simulations show that listeners are best modeled as attending primarily to the most salient phonetic feature of a category when interpreting a cue, possibly attending to other features only in cases of high ambiguity. These results support the conclusion that listeners ignore potentially informative correlations in favor of efficient communication.",>Rachael Richardson>Naomi Feldman>William Idsardi,">University of Maryland, College Park, MD, USA>University of Maryland, College Park, MD, USA>University of Maryland, College Park, MD, USA",https://mindmodeling.org/cogsci2015/papers/0342/index.html
2015,Transfer effects of prompted and self-reported analogical comparison and self-explanation,"We compared types of transfer facilitated by instructions to engage in analogical comparison or self-explanation. Participants received learning materials and worked examples with prompts supporting analogical comparison, self-explanation, or instructional explanation study. Learners also self-reported their use of analogical comparison and self-explanation on a series of questionnaires. We evaluated condition effects on self-reports and transfer, and the relations between self-reports and transfer. Receiving materials with analogical-comparison support and reporting greater levels of analogical comparison were both associated with worse transfer performance, while reporting greater levels of self-explanation was associated with better performance. Learners’ self-reports of analogical comparison and self-explanation were not related to condition assignment, suggesting that the questionnaires did not measure the same processes promoted by the intervention, or that individual differences are robust even when learners are instructed to engage in analogical comparison or self-explanation",>J. Elizabeth Richey>Cristina D. Zepeda>Timothy J. Nokes-Malach,>University of Pittsburgh>University of Pittsburgh>University of Pittsburgh,https://mindmodeling.org/cogsci2015/papers/0343/index.html
2015,How do different training tasks modulate our perception and hemispheric lateralization in the development of perceptual expertise?,"Holistic processing (HP) and hemispheric lateralization are both expertise markers of object recognition. For example, expertise in face and sub-ordinate object perception is shown to be associated with HP and stronger right hemispheric lateralization. However, HP is modulated by experiences of selective attention to parts such as writing experiences of Chinese characters and drawing experiences of faces. Meanwhile, hemispheric lateralization is associated with the decoding strategy employed in object recognition, such as left hemispheric lateralization for reading alphabetic scripts and right hemispheric lateralization for reading logographic scripts. This study aims at training participants to recognize the same sets of artificially-created scripts using either whole-word (Logographic) or grapheme-to-phoneme (Alphabetic) approaches. We found that both approaches induced strong HP, though the alphabetic approach induced stronger left hemisphere advantage than the logographic approach. This training study demonstrates that HP and hemispheric lateralization are separate processes that are associated with different perceptual mechanisms.",>Tso Ricky Van-yip>Au Terry Kit-fong>Hsiao Janet Hui-wen,">Department of Psychology, The University of Hong Kong>Department of Psychology, The University of Hong Kong>Department of Psychology, The University of Hong Kong",https://mindmodeling.org/cogsci2015/papers/0344/index.html
2015,Effects of Complementary Control on the Coordination Dynamics of Joint-Action,"Previous research has revealed that the behavioral dynamics of joint-action can naturally emerge from the physical and informational constraints that define a shared task-goal. The emergence of complementary actions is often an inherent aspect of robust and flexible joint-action performance. We examined the interpersonal coordination and control that emerged between two individuals performing a virtual labyrinth ball-control game. Key manipulations involved whether control was symmetrical (i.e. both individuals had full control of the board tilt) or asymmetrical (i.e. one with control of the x-axis of tilt and the other with control of the y-axis of tilt). Data on a solo individual two-handed version of the task was also collected for comparison purposes. Our results revealed that the patterns of synergistic coordination that emerged were similar for pairs and individuals, and that both pairs and individuals maintain task success by mutually adapting the coordination and control dynamics across different task manipulations.",>Lillian Rigoli>Veronica Romero>Kevin Shockley>Gregory Funke>Adam Strang>Michael Richardson,">University of California, Merced, San Diego, CA, United States>University of Cincinnati, Cincinnati, OH, United States>University of Cincinnati, Cincinnati, OH, United States>Air Force Research Laboratory, 711th Human Performance Wing, Wright-Patterson AFB, OH 45433, USA>Air Force Research Laboratory, 711th Human Performance Wing, Wright-Patterson AFB, OH 45433, USA>University of Cincinnati, Cincinnati, OH, United States",https://mindmodeling.org/cogsci2015/papers/0345/index.html
2015,Development of selective attention in category learning,"Categorization, the process of grouping distinguishable entities into equivalence classes, is an essential component of human cognition. Although it has been often argued that selective attention is an important component of categorization, organism with immature selective attention (such as human infants or young children) exhibit the ability to learn categories. This research addresses this apparent paradox by examining attention allocation in the course of category learning across development. Results suggest that while some young children are able to attend selectively, adults more flexibly deploy selective attention according to task demands.",>Samuel Rivera>Vladimir Sloutsky,">The Ohio State University, Columbus, OH, USA>The Ohio State University, Columbus, OH, USA",https://mindmodeling.org/cogsci2015/papers/0346/index.html
2015,Auditory Stimuli Slow Down Responses and First Fixations: Support for Auditory Dominance in Adults,"Under some situations sensory modalities compete for attention, with one modality attenuating processing in a second modality. Almost forty years of research with adults has shown that this competition is typically won by the visual modality. Using a discrimination task on an eye tracker, the current research provides novel support for auditory dominance, with words and nonlinguistic sounds slowing down visual processing. At the same time, there was no evidence suggesting that visual input slowed down auditory processing. Several eye tracking variables correlated with behavioral responses. Of particular interest is the finding that adults’ first fixations were delayed when images were paired with auditory input, especially nonlinguistic sounds. This finding is consistent with neurophysiological findings and also consistent with a potential mechanism underlying auditory dominance effects.",>Christopher Robinson>Wesley Barnhart>Samuel Rivera,>The Ohio State University>The Ohio State University>The Ohio State University,https://mindmodeling.org/cogsci2015/papers/0347/index.html
2015,"Capturing Social Motor Coordination: A comparison of the Microsoft Kinect, Video-Motion Analysis and the Polhemus Latus Motion Tracking System","Social motor coordination remains a relatively overlooked dimension of social behavior in children with ASD. One reason for the lack of research is that the motion tracking equipment historically used for recording body movements of children during social interaction has been very costly, as well as cumbersome and impractical. Here we examined whether two low-cost motion-tracking options can be employed to investigate social motor coordination in children with ASD. Of particular interest was the degree to which these low-cost methods of motion tracking could be used to capture and index the coordination dynamics that occurred between a child and an experimenter in comparison to a much more expensive, laboratory grade, motion tracking system. Overall, the results found the expensive system to be better than the low-cost methods, but that the latter two are still able to index differences in social motor coordination between typically developing and ASD children.",>Veronica Romero>Joseph Amaral>Paula Fitzpatrick>Richard Schmidt>Mike Richardson,">Center for Cognition, Action and Perception, University of Cincinnati, 4150 Edwards Cl., Cincinnati, OH 45221-0376 USA>Department of Psychology, University of Cincinnati, 4150 Edwards Cl., Cincinnati, OH 45221-0376 USA>Department of Psychology, Assumption College, 500 Salisbury St., Worcester, MA 01609-1265 USA>Department of Psychology, College of the Holy Cross, 1 College St., Worcester, MA 01609-2331 USA>Center for Cognition, Action and Perception, University of Cincinnati, 4150 Edwards Cl., Cincinnati, OH 45221-0376 USA",https://mindmodeling.org/cogsci2015/papers/0348/index.html
2015,Can Joint Action be Synergistic? Studying the Stabilization of Interpersonal Hand Coordination,"The human perceptual-motor system is tightly coupled to the physical and informational dynamics of a task environment and these dynamics operate to constrain the high-dimensional order of the human movement system into low-dimensional, task-specific synergies. The aim of the current study was to determine whether synergistic processes constrain and organize the behavior of co-acting individuals. Participants sat next to each other and each used one arm to complete a pointer-to-target task. Using the uncontrolled manifold, the structure of joint-angle variance was examined to determine whether there was synergistic organization at the interpersonal or intrapersonal levels. The results revealed the motor actions performed were synergistically organized at both the interpersonal and intrapersonal levels. More importantly, the interpersonal synergy was found to be significantly stronger than the intrapersonal synergies. Accordingly, the results provide clear evidence that the action dynamics of co-acting individuals can become temporarily organized to form single synergistic two-person systems.",>Veronica Romero>Rachel Kallen>Michael Riley>Mike Richardson,">Center for Cognition, Action and Perception, University of Cincinnati, 4150 Edwards Cl., Cincinnati, OH 45221-0376 USA>Department of Psychology, University of Cincinnati, 4130 Edwards Cl., Cincinnati, OH 45221-0376 USA>Center for Cognition, Action and Perception, University of Cincinnati, 4150 Edwards Cl., Cincinnati, OH 45221-0376 USA>Center for Cognition, Action and Perception, University of Cincinnati, 4150 Edwards Cl., Cincinnati, OH 45221-0376 USA",https://mindmodeling.org/cogsci2015/papers/0349/index.html
2015,Do Markov Violations and Failures of Explaining Away Persist with Experience?,"Making judgments by relying on beliefs about causal relations is a fundamental aspect of everyday cognition. Recent research has identified two ways that human reasoning seems to diverge from optimal standards; people appear to violate the Markov Assumption, and do not to “explain away” adequately. However, these habits have rarely been tested in the situation that presumably would promote accurate reasoning – after experiencing the multivariate distribution of the variables through trial-by-trial learning, even though this is a standard paradigm. Two studies test whether these habits persist 1) despite adequate learning experience, 2) despite incentives, and 3) whether they also extend to situations with continuous variables.",>Benjamin Rottman>Reid Hastie,">University of Pittsburgh, Pittsburgh, Pennsylvania, USA>The University of Chicago",https://mindmodeling.org/cogsci2015/papers/0350/index.html
2015,How Causal Mechanism and Autocorrelation Beliefs Inform Information Search,"When testing which of multiple causes (e.g., medicines) works the best, the testing sequence has important implications for the validity of the final judgment. Trying one cause for a period of time is important if the cause has tolerance, sensitization, delay, or carryover effects (TSDC). Alternating between the causes is important in autocorrelated environments – when the outcome naturally comes and goes in waves. Across two studies, participants’ beliefs about TSDC influenced the amount of alternating; however, their beliefs about autocorrelation had a very modest effect on the testing strategy. This research helps chart how well people adapt to various environments in order to optimize learning, and it suggests that in situations with no TSDC effects and high autocorrelation, people may not alternate enough.",>Benjamin Rottman,">University of Pittsburgh, Pittsburgh, Pennsylvania, USA",https://mindmodeling.org/cogsci2015/papers/0351/index.html
2015,"Children search for information as efficiently as adults, but seek additional confirmatory evidence","Like scientists, children and adults learn by asking informative questions and making informative interventions. How does this ability develop? We investigate how children (7- and 10-year-olds) and adults search for information to learn which kinds of objects share a causal property. We find an anticipated developmental improvement in information search efficiency. We also present a formal analysis that allows us to identify the strategic component responsible for children’s inefficiency. In our 20-questions-style task, children initially ask questions and make interventions no less efficiently than adults do, but continue to search for information past the point at which they have narrowed down their hypothesis space to a single option. In other words, the performance change from age seven to adulthood is due mainly to a change in implementing a “stopping rule”: when considering only the minimum number of queries participants would have needed to identify the correct hypothesis, age differences disappear.",>Azzurra Ruggeri>Tania Lombrozo>Tom Griffiths>Fei Xu,">University of California, Berkeley, Berkeley, CA, United States and Max Planck Institute for Human Development, Berlin>University of California, Berkeley>University of California, Berkeley>University of California, Berkeley",https://mindmodeling.org/cogsci2015/papers/0352/index.html
2015,Restoring the Context of Interrupted Work with Desktop Thumbnails,"Knowledge work is frequently interrupted. Interruptions enable collaboration and bring timely information, but they disrupt the fragile context of ongoing activities. Computers, now ubiquitous in knowledge work, have improved in their ability to track and restore digital context (documents and files), but they do a poor job of helping users restore mental context: the ideas, intentions, and motivations behind their work. Thumbnail images are an efficient way to help computer users refind documents; we ask if they can also be used to restore mental context. We tested how three manipulations to thumbnails of personal computer screenshots impact their ability to help viewers recognize past activities and recall accurate and detailed context. In a 2-week study we found that thumbnails of portions of the screen need to be larger than thumbnails of the entire screen for successful activity recognition and that static screenshots prompted more accurate contextual recall than animations.",>Adam Rule>Aurélien Tabard>Karen Boyd>James Hollan,>UC San Diego>Université Lyon 1>UC San Diego>UC San Diego,https://mindmodeling.org/cogsci2015/papers/0353/index.html
2015,Representing and Learning a Large System of Number Concepts with Latent Predicate Networks,"Conventional concept learning models typically acquire one concept at a time and underemphasize how many concepts are learned as part of systems rather than as individuals. Natural number is one of the first such abstract conceptual systems children learn. Models of number learning focused on single-concept acquisition have, however, largely ignored two challenges posed by number viewed as a conceptual system: 1) there are infinitely many semantically distinct number concepts; and 2) people can reason flexibly about any number concept. To succeed, models must learn the structure of the infinite set, focusing on how relationships between numbers support reference and generalization. Here, we suggest that latent predicate networks (LPNs) – a probabilistic grammar formalism – facilitate tractable learning and reasoning for number concepts. We show how to express several key numerical relationships in our framework, and how Bayesian learning for LPNs models key phenomena observed in children learning to count.",>Joshua Rule>Eyal Dechter>Joshua Tenenbaum,>Massachusetts Institute of Technology>Massachusetts Institute of Technology>Massachusetts Institute of Technology,https://mindmodeling.org/cogsci2015/papers/0354/index.html
2015,Helping students understand posterior probabilities: research with a digital learning environment on the Monty Hall dilemma,"When initially confronted with the Monty Hall dilemma (MHD), people show a strong tendency to stick with their initial choice, although switching maximizes winning chances. Previous research demonstrated interventions that helped participants to apply the optimal strategy, but still failed to increase participants’ understanding of the MHD solution. An exception is DiBattista’s (2011) digital learning environment study, reporting that the majority of participants who used the learning environment learned to understand the MHD solution. However, a major shortcoming was the methodology, which did not allow to infer causal relations and to conclude which manipulation was most important for participants’ understanding. The aim of the present study was to fill this research gap by conducting a controlled randomized experiment with an analogous digital learning environment. The results showed that receiving explanation about the MHD solution was the most important manipulation to improve understanding. Implications for education in (posterior) probability are discussed.",>Lore Saenen>Mieke Heyvaert>Wim Van Dooren>Patrick Onghena,">KU Leuven, Leuven, Belgium>KU Leuven, Leuven, Belgium>KU Leuven, Leuven, Belgium>KU Leuven, Leuven, Belgium",https://mindmodeling.org/cogsci2015/papers/0355/index.html
